{
  "$schema": "https://json-schema.org/draft/2020-12/schema",
  "$id": "urn:archolith:beacon:schema:init-report:1.1",
  "title": "Beacon Initialization Report 1.1",
  "type": "object",
  "additionalProperties": false,
  "required": [
    "beacon_init_report_version",
    "operation",
    "repository_root",
    "manifest_path",
    "would_write",
    "written",
    "replaced",
    "discovered",
    "omitted",
    "review_required",
    "security_findings"
  ],
  "properties": {
    "beacon_init_report_version": {
      "const": "1.1"
    },
    "operation": {
      "type": "string",
      "enum": [
        "dry_run",
        "create",
        "replace",
        "refused"
      ]
    },
    "repository_root": {
      "const": "."
    },
    "manifest_path": {
      "$ref": "#/$defs/relativePath"
    },
    "would_write": {
      "type": "boolean"
    },
    "written": {
      "type": "boolean"
    },
    "replaced": {
      "type": "boolean"
    },
    "discovered": {
      "type": "array",
      "items": {
        "$ref": "#/$defs/discoveredField"
      }
    },
    "omitted": {
      "type": "array",
      "items": {
        "$ref": "#/$defs/reviewItem"
      }
    },
    "review_required": {
      "type": "array",
      "items": {
        "$ref": "#/$defs/reviewItem"
      }
    },
    "security_findings": {
      "type": "array",
      "items": {
        "$ref": "#/$defs/securityFinding"
      }
    },
    "git_evidence": {
      "$ref": "#/$defs/gitEvidence"
    }
  },
  "$defs": {
    "relativePath": {
      "type": "string",
      "minLength": 1,
      "maxLength": 1024,
      "pattern": "^(?!/)(?![A-Za-z]:)(?!.*(?:^|/)\\.\\.(?:/|$))[^\\\\]+(?:/[^\\\\]+)*$"
    },
    "evidence": {
      "type": "object",
      "additionalProperties": false,
      "required": [
        "kind",
        "path"
      ],
      "properties": {
        "kind": {
          "type": "string",
          "enum": [
            "directory_name",
            "git_remote",
            "build_file",
            "license_file",
            "document"
          ]
        },
        "path": {
          "$ref": "#/$defs/relativePath"
        },
        "sha256": {
          "type": "string",
          "pattern": "^[0-9a-f]{64}$"
        }
      }
    },
    "discoveredField": {
      "type": "object",
      "additionalProperties": false,
      "required": [
        "manifest_path",
        "value",
        "evidence"
      ],
      "properties": {
        "manifest_path": {
          "type": "string",
          "minLength": 1,
          "maxLength": 256
        },
        "value": true,
        "evidence": {
          "type": "array",
          "minItems": 1,
          "items": {
            "$ref": "#/$defs/evidence"
          }
        }
      }
    },
    "reviewItem": {
      "type": "object",
      "additionalProperties": false,
      "required": [
        "code",
        "manifest_path",
        "reason"
      ],
      "properties": {
        "code": {
          "type": "string",
          "pattern": "^[a-z][a-z0-9_]{1,63}$"
        },
        "manifest_path": {
          "type": "string",
          "minLength": 1,
          "maxLength": 256
        },
        "reason": {
          "type": "string",
          "minLength": 1,
          "maxLength": 2048
        },
        "evidence_checked": {
          "type": "array",
          "items": {
            "$ref": "#/$defs/relativePath"
          }
        }
      }
    },
    "securityFinding": {
      "type": "object",
      "additionalProperties": false,
      "required": [
        "code",
        "path",
        "blocked"
      ],
      "properties": {
        "code": {
          "type": "string",
          "enum": [
            "sensitive_private_key",
            "sensitive_credential_url",
            "sensitive_known_token",
            "sensitive_file_excluded"
          ]
        },
        "path": {
          "$ref": "#/$defs/relativePath"
        },
        "line": {
          "type": "integer",
          "minimum": 1
        },
        "blocked": {
          "type": "boolean"
        }
      }
    },
    "isoDate": {
      "type": "string",
      "pattern": "^\\d{4}-\\d{2}-\\d{2}T\\d{2}:\\d{2}:\\d{2}(?:\\.\\d+)?(?:Z|[+-]\\d{2}:\\d{2})$"
    },
    "gitHead": {
      "type": "object",
      "additionalProperties": false,
      "required": [
        "commit",
        "branch",
        "dirty",
        "dirty_paths"
      ],
      "properties": {
        "commit": {
          "$ref": "#/$defs/gitOid"
        },
        "branch": {
          "anyOf": [
            {
              "type": "string",
              "minLength": 1,
              "maxLength": 256
            },
            {
              "type": "null"
            }
          ]
        },
        "dirty": {
          "type": "boolean"
        },
        "dirty_paths": {
          "type": "integer",
          "minimum": 0
        }
      }
    },
    "gitTag": {
      "type": "object",
      "additionalProperties": false,
      "required": [
        "name",
        "commit",
        "date"
      ],
      "properties": {
        "name": {
          "type": "string",
          "minLength": 1,
          "maxLength": 256
        },
        "commit": {
          "$ref": "#/$defs/gitOid"
        },
        "date": {
          "$ref": "#/$defs/isoDate"
        }
      }
    },
    "gitCommit": {
      "type": "object",
      "additionalProperties": false,
      "required": [
        "commit",
        "date",
        "subject"
      ],
      "properties": {
        "commit": {
          "$ref": "#/$defs/gitOid"
        },
        "date": {
          "$ref": "#/$defs/isoDate"
        },
        "subject": {
          "type": "string",
          "maxLength": 120
        },
        "subject_redacted": {
          "type": "boolean"
        }
      }
    },
    "gitFileHistory": {
      "type": "object",
      "additionalProperties": false,
      "required": [
        "path",
        "changes",
        "last_commit",
        "last_date",
        "introduced_in",
        "removed_in",
        "renamed_from"
      ],
      "properties": {
        "path": {
          "$ref": "#/$defs/relativePath"
        },
        "changes": {
          "type": "integer",
          "minimum": 1
        },
        "last_commit": {
          "$ref": "#/$defs/gitOid"
        },
        "last_date": {
          "$ref": "#/$defs/isoDate"
        },
        "introduced_in": {
          "anyOf": [
            {
              "$ref": "#/$defs/gitOid"
            },
            {
              "type": "null"
            }
          ]
        },
        "removed_in": {
          "anyOf": [
            {
              "$ref": "#/$defs/gitOid"
            },
            {
              "type": "null"
            }
          ]
        },
        "renamed_from": {
          "type": "array",
          "items": {
            "$ref": "#/$defs/relativePath"
          }
        }
      }
    },
    "gitCoChange": {
      "type": "object",
      "additionalProperties": false,
      "required": [
        "paths",
        "commits"
      ],
      "properties": {
        "paths": {
          "type": "array",
          "minItems": 2,
          "maxItems": 2,
          "items": {
            "$ref": "#/$defs/relativePath"
          }
        },
        "commits": {
          "type": "integer",
          "minimum": 2
        }
      }
    },
    "gitEvidence": {
      "type": "object",
      "additionalProperties": false,
      "required": [
        "adapter",
        "adapter_version",
        "head",
        "tracked_file_count",
        "tracked_dirs",
        "tags",
        "recent_commits",
        "activity",
        "file_history",
        "co_change",
        "window_commits",
        "truncated"
      ],
      "properties": {
        "adapter": {
          "const": "git"
        },
        "adapter_version": {
          "const": "1"
        },
        "head": {
          "anyOf": [
            {
              "$ref": "#/$defs/gitHead"
            },
            {
              "type": "null"
            }
          ]
        },
        "tracked_file_count": {
          "type": "integer",
          "minimum": 0
        },
        "tracked_dirs": {
          "type": "array",
          "maxItems": 64,
          "items": {
            "type": "object",
            "additionalProperties": false,
            "required": [
              "path",
              "files"
            ],
            "properties": {
              "path": {
                "$ref": "#/$defs/relativePath"
              },
              "files": {
                "type": "integer",
                "minimum": 1
              }
            }
          }
        },
        "tags": {
          "type": "array",
          "maxItems": 30,
          "items": {
            "$ref": "#/$defs/gitTag"
          }
        },
        "recent_commits": {
          "type": "array",
          "maxItems": 20,
          "items": {
            "$ref": "#/$defs/gitCommit"
          }
        },
        "activity": {
          "type": "array",
          "maxItems": 32,
          "items": {
            "type": "object",
            "additionalProperties": false,
            "required": [
              "path",
              "commits"
            ],
            "properties": {
              "path": {
                "$ref": "#/$defs/relativePath"
              },
              "commits": {
                "type": "integer",
                "minimum": 1
              }
            }
          }
        },
        "file_history": {
          "type": "array",
          "maxItems": 200,
          "items": {
            "$ref": "#/$defs/gitFileHistory"
          }
        },
        "co_change": {
          "type": "array",
          "maxItems": 25,
          "items": {
            "$ref": "#/$defs/gitCoChange"
          }
        },
        "window_commits": {
          "type": "integer",
          "minimum": 0
        },
        "truncated": {
          "type": "boolean"
        }
      }
    },
    "gitOid": {
      "type": "string",
      "pattern": "^([0-9a-f]{40}|[0-9a-f]{64})$"
    }
  }
}
